{
  "_meta": {
    "schema_version": 2,
    "produced_by": "launch_record.write_intervention",
    "produced_at_pt": "2026-10-26T01:18:18-07:00",
    "studies_git_sha": "748b47f054b43cdd048edc23b9d9457af45404a7",
    "studies_git_dirty": true,
    "wrapper_git_sha": null,
    "wandb_groups": [
      "hattori@20261026-002131"
    ],
    "source_studies_git_shas": [
      "32bcf415c5f18d16a07dda5fb4dee914feabd177"
    ],
    "source_dispatcher_git_shas": [
      "5936f5d0b94b1fb5ec9d95058067716f261e5555"
    ],
    "source_wrapper_git_shas": [
      "04878a6cdb081b0156b96ac1e61dde5de58d492e"
    ],
    "source_foraging_models_git_shas": [
      "ef1d31a291e41a756d49b46ee15b3e0c3fa373b2"
    ],
    "provenance_findings": []
  },
  "kind": "rescue",
  "platform": "hpc",
  "wandb_group": "hattori@20261026-002131",
  "label": "rescue-oom",
  "note": "Refit and score the 16 held-out subjects whose production tasks ran out of memory, so the pooled r1 covers all 149.",
  "revisions": {
    "studies": "32bcf415c5f18d16a07dda5fb4dee914feabd177",
    "dispatcher": "5936f5d0b94b1fb5ec9d95058067716f261e5555",
    "wrapper": "04878a6cdb081b0156b96ac1e61dde5de58d492e",
    "foraging_models": "ef1d31a291e41a756d49b46ee15b3e0c3fa373b2"
  },
  "manifests": [
    "sweep_hpc_per_subject.yaml",
    "launch_record/production/sweep_submitted.yaml"
  ],
  "job_refs": [
    {
      "type": "slurm_array_job",
      "id": "27500798"
    }
  ],
  "supersedes": [
    "27500576 tasks 2,41,44,46,47,52,54,64,65,66,69,71,83,84,127,137"
  ],
  "trigger": {
    "symptom": "16 of 149 production array tasks ended OUT_OF_MEMORY at 64G",
    "cause": "session-marginal scoring (6000 x 24 draws per session, chunks of 8 sessions) exceeds 64G for subjects with many or long eval sessions; each had saved its posterior draws first",
    "evidence": {
      "subjects": [
        "452275",
        "700708",
        "627042",
        "472184",
        "455525",
        "791174",
        "790768",
        "727456",
        "641494",
        "639875",
        "651475",
        "643773",
        "656489",
        "668551",
        "823166",
        "713379"
      ],
      "launch_array": "27500576"
    }
  },
  "tasks": [
    {
      "subject_id": "452275"
    },
    {
      "subject_id": "700708"
    },
    {
      "subject_id": "627042"
    },
    {
      "subject_id": "472184"
    },
    {
      "subject_id": "455525"
    },
    {
      "subject_id": "791174"
    },
    {
      "subject_id": "790768"
    },
    {
      "subject_id": "727456"
    },
    {
      "subject_id": "641494"
    },
    {
      "subject_id": "639875"
    },
    {
      "subject_id": "651475"
    },
    {
      "subject_id": "643773"
    },
    {
      "subject_id": "656489"
    },
    {
      "subject_id": "668551"
    },
    {
      "subject_id": "823166"
    },
    {
      "subject_id": "713379"
    }
  ],
  "deviations": {
    "memory": "200G per task (launch: 64G)",
    "route": "run_hpc invoked directly per subject from rescue.sbatch, not via the W&B sweep agent (the sweep does not reissue finished grid points); same command, overrides and +meta lineage as sweep_submitted.yaml, plus +meta.intervention=rescue-oom",
    "fresh_run_ids": true
  },
  "cost": {},
  "data": {
    "source": "snapshot",
    "config": "mice_snapshot_scaling",
    "type": "mice_snapshot",
    "snapshot": "20260603",
    "uri": "s3://aind-scratch-data/aind-dynamic-foraging-cache/snapshots/20260603/",
    "manifest_sha256": "e5fd51da432b5f3e1dda969a5ceb415766a9f96d0c90131157be3b809cdac0d3",
    "build_id": "20260630T054811Z",
    "n_sessions": 23585
  },
  "image": {
    "platform": "hpc",
    "conda_env": "/allen/aind/scratch/han.hou/miniforge3/envs/dynamic-foraging-bfm-cpu",
    "lock_sha256": "e8a3a8e735e722e6ec842460b88eb429da2a43d036da93e7c7360d3bf160bba0"
  }
}
